{
  "$schema": "../schema/visual-system.schema.json",
  "schemaVersion": 1,
  "id": "waft-global-visual-system",
  "version": "0.18.0",
  "status": "prototype",
  "style": {
    "direction": "stylized_naturalism",
    "naturalismRatio": 0.65,
    "stylizationRatio": 0.35,
    "forbiddenPatterns": [
      "visible-primitive-character-construction",
      "uniform-green-terrain",
      "single-box-building-language",
      "random-global-palette",
      "zone-specific-render-branching"
    ]
  },
  "compatibility": {
    "minimumAdventureVersion": "0.17.0",
    "preserveSaveKeys": [
      "waft.adventure.0170.world.v1",
      "waft.baleares.travel.v1",
      "waft.catalunya-litoral.travel.v1"
    ],
    "fallbackRuntime": "waft-0170.html",
    "visualStateIsAuthoritative": false
  },
  "assetPipeline": {
    "modelFormat": "glb",
    "textureFormat": "ktx2-basis",
    "coordinateSystem": "y-up-right-handed-front-positive-z",
    "unit": "meter",
    "assetStates": ["placeholder", "candidate", "approved", "deprecated"],
    "requiredLods": ["lod0", "lod1", "lod2", "shadow"]
  },
  "qualityProfiles": [
    {
      "id": "mobile-low",
      "status": "prototype",
      "targetFps": 30,
      "resolutionScale": { "minimum": 0.65, "maximum": 0.85 },
      "maximumTextureSize": 1024,
      "heroTextureSize": 1024,
      "shadowMode": "hero-only",
      "budgets": {
        "visibleTriangles": { "recommended": 320000, "hardMaximum": 480000 },
        "drawCalls": { "recommended": 120, "hardMaximum": 180 },
        "visibleInstances": { "recommended": 2500, "hardMaximum": 4500 },
        "residentTexturesMb": { "recommended": 64, "hardMaximum": 88 },
        "residentGeometryMb": { "recommended": 32, "hardMaximum": 48 },
        "initialPackageMb": { "recommended": 24, "hardMaximum": 38 },
        "firstUsefulFrameSeconds": { "recommended": 6, "hardMaximum": 10 }
      }
    },
    {
      "id": "mobile-target",
      "status": "candidate",
      "targetFps": 30,
      "aspirationalFps": 60,
      "resolutionScale": { "minimum": 0.8, "maximum": 1 },
      "maximumTextureSize": 1024,
      "heroTextureSize": 2048,
      "shadowMode": "limited-directional",
      "budgets": {
        "visibleTriangles": { "recommended": 550000, "hardMaximum": 750000 },
        "drawCalls": { "recommended": 180, "hardMaximum": 260 },
        "visibleInstances": { "recommended": 4000, "hardMaximum": 7500 },
        "residentTexturesMb": { "recommended": 96, "hardMaximum": 128 },
        "residentGeometryMb": { "recommended": 48, "hardMaximum": 72 },
        "initialPackageMb": { "recommended": 35, "hardMaximum": 55 },
        "firstUsefulFrameSeconds": { "recommended": 6.5, "hardMaximum": 8 }
      }
    },
    {
      "id": "desktop-capture",
      "status": "planned",
      "targetFps": 60,
      "resolutionScale": { "minimum": 1, "maximum": 1.5 },
      "maximumTextureSize": 2048,
      "heroTextureSize": 4096,
      "shadowMode": "full-directional",
      "budgets": {
        "visibleTriangles": { "recommended": 1300000, "hardMaximum": 2000000 },
        "drawCalls": { "recommended": 320, "hardMaximum": 500 },
        "visibleInstances": { "recommended": 9000, "hardMaximum": 15000 },
        "residentTexturesMb": { "recommended": 256, "hardMaximum": 384 },
        "residentGeometryMb": { "recommended": 120, "hardMaximum": 180 },
        "initialPackageMb": { "recommended": 55, "hardMaximum": 90 },
        "firstUsefulFrameSeconds": { "recommended": 5, "hardMaximum": 8 }
      }
    }
  ],
  "materialFamilies": [
    {
      "id": "mediterranean-ground",
      "status": "prototype",
      "kind": "terrain",
      "channels": ["baseColor", "normal", "roughness", "ambientOcclusion"],
      "maximumResolution": 1024,
      "tags": ["dry-grass", "light-soil", "limestone", "compact-dirt"]
    },
    {
      "id": "mountain-humid-ground",
      "status": "prototype",
      "kind": "terrain",
      "channels": ["baseColor", "normal", "roughness", "ambientOcclusion"],
      "maximumResolution": 1024,
      "tags": ["leaf-litter", "dark-soil", "moss", "rock-dark"]
    },
    {
      "id": "urban-mediterranean-surface",
      "status": "prototype",
      "kind": "terrain",
      "channels": ["baseColor", "normal", "roughness", "ambientOcclusion"],
      "maximumResolution": 1024,
      "tags": ["asphalt", "urban-stone", "pavement", "gravel"]
    },
    {
      "id": "balearic-masonry",
      "status": "planned",
      "kind": "architecture",
      "channels": ["baseColor", "normal", "roughness", "ambientOcclusion"],
      "maximumResolution": 2048,
      "tags": ["limestone", "white-plaster", "terracotta", "wood-shutter"]
    },
    {
      "id": "iberian-urban-facade",
      "status": "planned",
      "kind": "architecture",
      "channels": ["baseColor", "normal", "roughness", "ambientOcclusion", "emissive"],
      "maximumResolution": 2048,
      "tags": ["stucco", "stone-base", "balcony-metal", "roof-tile"]
    },
    {
      "id": "catalan-mountain-masonry",
      "status": "planned",
      "kind": "architecture",
      "channels": ["baseColor", "normal", "roughness", "ambientOcclusion"],
      "maximumResolution": 2048,
      "tags": ["dark-stone", "timber", "sloped-roof", "weathered-plaster"]
    },
    {
      "id": "mediterranean-foliage",
      "status": "planned",
      "kind": "vegetation",
      "channels": ["baseColor", "normal", "roughness", "opacity"],
      "maximumResolution": 1024,
      "tags": ["pine", "olive", "holm-oak", "dry-shrub"]
    },
    {
      "id": "temperate-mountain-foliage",
      "status": "planned",
      "kind": "vegetation",
      "channels": ["baseColor", "normal", "roughness", "opacity"],
      "maximumResolution": 1024,
      "tags": ["mountain-pine", "deciduous", "humid-shrub", "moss"]
    },
    {
      "id": "mediterranean-water",
      "status": "prototype",
      "kind": "water",
      "channels": ["baseColor", "normal", "roughness", "opacity"],
      "maximumResolution": 1024,
      "tags": ["clear-coast", "harbour", "shallow-depth", "foam-edge"]
    },
    {
      "id": "barbary-macaque-material",
      "status": "planned",
      "kind": "character",
      "channels": ["baseColor", "normal", "roughness", "ambientOcclusion"],
      "maximumResolution": 2048,
      "tags": ["fur", "skin", "eyes", "nails"]
    }
  ],
  "visualBiomes": [
    {
      "id": "mediterranean-coastal",
      "status": "candidate",
      "terrainMaterials": ["mediterranean-ground", "urban-mediterranean-surface"],
      "vegetationFamilies": ["mediterranean-pine-scrub", "mediterranean-orchard", "urban-mediterranean-trees"],
      "lightingProfile": "mediterranean-clear-day",
      "waterProfile": "mediterranean-coastal-water",
      "combatBiomeFallbacks": ["marine", "forest", "mountain"]
    },
    {
      "id": "mediterranean-inland",
      "status": "candidate",
      "terrainMaterials": ["mediterranean-ground", "urban-mediterranean-surface"],
      "vegetationFamilies": ["mediterranean-pine-scrub", "mediterranean-orchard"],
      "lightingProfile": "mediterranean-warm-day",
      "waterProfile": "inland-water-basic",
      "combatBiomeFallbacks": ["forest", "mountain"]
    },
    {
      "id": "temperate-mountain",
      "status": "candidate",
      "terrainMaterials": ["mountain-humid-ground", "urban-mediterranean-surface"],
      "vegetationFamilies": ["temperate-mountain-forest", "mountain-ground-cover"],
      "lightingProfile": "humid-mountain-clouds",
      "waterProfile": "mountain-stream-water",
      "combatBiomeFallbacks": ["forest", "mountain"]
    },
    {
      "id": "alpine-snow",
      "status": "planned",
      "terrainMaterials": ["mountain-humid-ground", "urban-mediterranean-surface"],
      "vegetationFamilies": ["temperate-mountain-forest"],
      "lightingProfile": "alpine-snow-day",
      "waterProfile": "cold-water-basic",
      "combatBiomeFallbacks": ["arctic", "mountain"]
    },
    {
      "id": "hot-sandy-desert",
      "status": "planned",
      "terrainMaterials": ["mediterranean-ground", "urban-mediterranean-surface"],
      "vegetationFamilies": ["mediterranean-pine-scrub"],
      "lightingProfile": "desert-clear-day",
      "waterProfile": "oasis-water-basic",
      "combatBiomeFallbacks": ["desert"]
    },
    {
      "id": "tropical-rainforest",
      "status": "planned",
      "terrainMaterials": ["mountain-humid-ground", "urban-mediterranean-surface"],
      "vegetationFamilies": ["temperate-mountain-forest", "mountain-ground-cover"],
      "lightingProfile": "tropical-humid-day",
      "waterProfile": "tropical-water-basic",
      "combatBiomeFallbacks": ["jungle"]
    }
  ],
  "environmentModifiers": [
    { "id": "humid", "status": "candidate", "effects": ["terrain", "vegetation", "lighting", "atmosphere"] },
    { "id": "dry", "status": "candidate", "effects": ["terrain", "vegetation", "architecture", "lighting"] },
    { "id": "rocky", "status": "candidate", "effects": ["terrain", "vegetation", "props"] },
    { "id": "agricultural", "status": "candidate", "effects": ["terrain", "vegetation", "architecture", "props"] },
    { "id": "coastal-salt", "status": "candidate", "effects": ["terrain", "vegetation", "architecture", "water", "atmosphere"] },
    { "id": "urban-heat", "status": "prototype", "effects": ["terrain", "vegetation", "architecture", "lighting"] },
    { "id": "wind-exposed", "status": "planned", "effects": ["vegetation", "atmosphere"] },
    { "id": "snow-seasonal", "status": "planned", "effects": ["terrain", "vegetation", "architecture", "water", "lighting"] }
  ],
  "culturalFamilies": [
    {
      "id": "balearic",
      "status": "candidate",
      "architectureFamilies": ["balearic-rural", "mediterranean-village", "mediterranean-port", "modern-mediterranean-residential"],
      "propKits": ["balearic-rural-kit", "mediterranean-street-kit", "mediterranean-port-kit", "agriculture-kit"],